{
  "$schema": "../../docs/zh_cn/schemas/recipe/part_fabricating_recipe.schema.json",
  "type": "machine_max:part_fabricating",
  "ingredients": [
    {
      "ingredient": {
        "item": "machine_max:structural_component_1"
      },
      "count": 2
    },
    {
      "ingredient": {
        "item": "minecraft:iron_ingot"
      },
      "count": 2
    }
  ],
  "result": {
    "count": 1
  },
  "time": 80
}
