{
  "$schema": "../../docs/zh_cn/schemas/recipe/part_fabricating_recipe.schema.json",
  "type": "machine_max:part_fabricating",
  "ingredients": [
    {
      "ingredient": {
        "item": "machine_max:power_component_1"
      },
      "count": 24
    },
    {
      "ingredient": {
        "item": "machine_max:mechanic_component_1"
      },
      "count": 16
    },
    {
      "ingredient": {
        "item": "machine_max:electronic_component_1"
      },
      "count": 32
    },
    {
      "ingredient": {
        "item": "machine_max:structural_component_1"
      },
      "count": 64
    }
  ],
  "result": {
    "count": 1
  },
  "time": 300
}

